grado,conoscenza
1,"Semplici frasi che permettono una comunicazione a livello elementare (E buono da mangiare? C'è pericolo? Quanto costa? Dov'è il bagno?, ecc.). Nessuna conoscenza di lettura e scrittura."
2,"Se entrambi i colloquianti parlano lentamente, scandendo le parole, consente di discutere su semplici concetti, senza troppi giri di parole. Uno sguardo ad una scrittura può far capire i concetti generali e singole frasi, ma non i particolari. Nessuna conoscenza della scrittura."
3,"Consente di parlare, in modo scorrevole, come i madrelinqua di media educazione, ma con frequenti inflessioni dialettali (sbaglio di accenti, di tonalità, ecc.); di leggere e scrivere frasi non troppo difficili, ma non i concetti più complessi."
4,Consente di parlare come per il grado 3 e di leggere e scrivere come un uomo di buona cultura.
5,"Conoscenza perfetta della lingua, che consente di senza alcun accento e di avere una padronanza totale nello scrivere e nel leggere."